{
  "_generated": "GENERATED — do not hand-edit. repo-derived (packages/tokens/atlas.tokens.css); regenerated by atlas-figma-sync.",
  "source": "repo-derived (packages/tokens/atlas.tokens.css)",
  "syncedAt": null,
  "figmaVersion": null,
  "note": "Semantic tokens and layout scales only. Primitive colour ramps (--atlas-color-*) are never used in app code.",
  "semantic": {
    "--atlas-background": "var(--atlas-color-neutral-0)",
    "--atlas-background-subtle": "var(--atlas-color-neutral-50)",
    "--atlas-background-muted": "var(--atlas-color-neutral-100)",
    "--atlas-background-accent": "var(--atlas-color-neutral-100)",
    "--atlas-background-hovered": "var(--atlas-color-neutral-50)",
    "--atlas-surface": "var(--atlas-color-neutral-0)",
    "--atlas-surface-raised": "var(--atlas-color-neutral-0)",
    "--atlas-surface-overlay": "var(--atlas-color-neutral-0)",
    "--atlas-border": "var(--atlas-color-neutral-200)",
    "--atlas-border-strong": "var(--atlas-color-neutral-300)",
    "--atlas-border-subtle": "var(--atlas-color-neutral-100)",
    "--atlas-border-inverse": "var(--atlas-color-neutral-0)",
    "--atlas-foreground": "var(--atlas-color-neutral-950)",
    "--atlas-foreground-muted": "var(--atlas-color-neutral-600)",
    "--atlas-foreground-subtle": "var(--atlas-color-neutral-500)",
    "--atlas-foreground-disabled": "var(--atlas-color-neutral-400)",
    "--atlas-foreground-on-brand": "var(--atlas-color-neutral-0)",
    "--atlas-primary": "var(--atlas-color-brand-600)",
    "--atlas-primary-hover": "var(--atlas-color-brand-700)",
    "--atlas-primary-active": "var(--atlas-color-brand-800)",
    "--atlas-primary-subtle": "var(--atlas-color-brand-50)",
    "--atlas-primary-foreground": "var(--atlas-color-neutral-0)",
    "--atlas-success": "var(--atlas-color-success-600)",
    "--atlas-success-subtle": "var(--atlas-color-success-50)",
    "--atlas-success-muted": "var(--atlas-color-success-100)",
    "--atlas-success-foreground": "var(--atlas-color-neutral-0)",
    "--atlas-warning": "var(--atlas-color-warning-500)",
    "--atlas-warning-subtle": "var(--atlas-color-warning-50)",
    "--atlas-warning-muted": "var(--atlas-color-warning-100)",
    "--atlas-warning-foreground": "var(--atlas-color-neutral-950)",
    "--atlas-danger": "var(--atlas-color-danger-600)",
    "--atlas-danger-hover": "var(--atlas-color-danger-700)",
    "--atlas-danger-subtle": "var(--atlas-color-danger-50)",
    "--atlas-danger-muted": "var(--atlas-color-danger-100)",
    "--atlas-danger-foreground": "var(--atlas-color-neutral-0)",
    "--atlas-info": "var(--atlas-color-info-600)",
    "--atlas-info-subtle": "var(--atlas-color-info-50)",
    "--atlas-info-muted": "var(--atlas-color-info-100)",
    "--atlas-info-foreground": "var(--atlas-color-neutral-0)",
    "--atlas-focus-ring": "var(--atlas-color-brand-500)",
    "--atlas-overlay": "var(--atlas-color-neutral-950)"
  },
  "scales": {
    "--atlas-spacing-0": "0px",
    "--atlas-spacing-px": "1px",
    "--atlas-spacing-0_5": "2px",
    "--atlas-spacing-1": "4px",
    "--atlas-spacing-1_5": "6px",
    "--atlas-spacing-2": "8px",
    "--atlas-spacing-3": "12px",
    "--atlas-spacing-4": "16px",
    "--atlas-spacing-5": "20px",
    "--atlas-spacing-6": "24px",
    "--atlas-spacing-8": "32px",
    "--atlas-spacing-9": "36px",
    "--atlas-spacing-10": "40px",
    "--atlas-spacing-12": "48px",
    "--atlas-spacing-16": "64px",
    "--atlas-radius-base": "8px",
    "--atlas-radius-none": "0px",
    "--atlas-radius-sm": "4px",
    "--atlas-radius-md": "var(--atlas-radius-base)",
    "--atlas-radius-lg": "12px",
    "--atlas-radius-xl": "16px",
    "--atlas-radius-2xl": "24px",
    "--atlas-radius-full": "9999px",
    "--atlas-font-size-xs": "12px",
    "--atlas-font-size-sm": "14px",
    "--atlas-font-size-base": "16px",
    "--atlas-font-size-lg": "18px",
    "--atlas-font-size-xl": "20px",
    "--atlas-font-size-2xl": "24px",
    "--atlas-font-size-3xl": "30px",
    "--atlas-font-size-4xl": "36px",
    "--atlas-font-size-5xl": "48px",
    "--atlas-text-h1": "28px",
    "--atlas-text-h2": "22px",
    "--atlas-text-h3": "18px",
    "--atlas-text-h4": "16px",
    "--atlas-text-body": "var(--atlas-font-size-base)",
    "--atlas-text-body-sm": "var(--atlas-font-size-sm)",
    "--atlas-text-caption": "var(--atlas-font-size-xs)",
    "--atlas-font-weight-regular": "400",
    "--atlas-font-weight-medium": "500",
    "--atlas-font-weight-semibold": "600",
    "--atlas-font-weight-bold": "700",
    "--atlas-line-height-tight": "1.2",
    "--atlas-line-height-snug": "1.35",
    "--atlas-line-height-normal": "1.5",
    "--atlas-line-height-relaxed": "1.65",
    "--atlas-duration-instant": "0ms",
    "--atlas-duration-fast": "120ms",
    "--atlas-duration-base": "200ms",
    "--atlas-duration-slow": "320ms",
    "--atlas-duration-spin": "1000ms",
    "--atlas-duration-pulse": "2000ms",
    "--atlas-easing-linear": "cubic-bezier(0, 0, 1, 1)",
    "--atlas-easing-standard": "cubic-bezier(0.2, 0, 0, 1)",
    "--atlas-easing-emphasized": "cubic-bezier(0.3, 0, 0, 1)",
    "--atlas-easing-exit": "cubic-bezier(0.4, 0, 1, 1)",
    "--atlas-shadow-sm": "0 1px 2px 0 oklch(0 0 0 / 0.05)",
    "--atlas-shadow-md": "0 2px 4px -1px oklch(0 0 0 / 0.06), 0 4px 8px -2px oklch(0 0 0 / 0.08)",
    "--atlas-shadow-lg": "0 4px 8px -2px oklch(0 0 0 / 0.08), 0 12px 24px -4px oklch(0 0 0 / 0.10)",
    "--atlas-shadow-xl": "0 8px 16px -4px oklch(0 0 0 / 0.10), 0 24px 48px -8px oklch(0 0 0 / 0.14)",
    "--atlas-border-width-0": "0px",
    "--atlas-border-width-1": "1px",
    "--atlas-border-width-2": "2px",
    "--atlas-opacity-disabled": "0.5",
    "--atlas-opacity-hover": "0.9",
    "--atlas-opacity-overlay": "0.6",
    "--atlas-opacity-pulse": "0.5",
    "--atlas-touch-min": "44px",
    "--atlas-touch-comfortable": "48px",
    "--atlas-touch-spacious": "56px",
    "--atlas-font-sans": "\"Nunito Sans\", ui-sans-serif, system-ui, sans-serif",
    "--atlas-font-arabic": "\"Noto Sans Arabic\", ui-sans-serif, system-ui, sans-serif",
    "--atlas-font-mono": "\"JetBrains Mono\", ui-monospace, monospace",
    "--atlas-letter-spacing-tight": "-0.01em",
    "--atlas-letter-spacing-normal": "0em",
    "--atlas-letter-spacing-wide": "0.02em",
    "--atlas-breakpoint-sm": "640px",
    "--atlas-breakpoint-md": "768px",
    "--atlas-breakpoint-lg": "1024px",
    "--atlas-breakpoint-xl": "1280px",
    "--atlas-breakpoint-2xl": "1536px",
    "--atlas-container-sm": "640px",
    "--atlas-container-md": "768px",
    "--atlas-container-lg": "1024px",
    "--atlas-container-xl": "1280px",
    "--atlas-container-2xl": "1536px",
    "--atlas-columns-mobile": "4",
    "--atlas-columns-tablet": "8",
    "--atlas-columns-desktop": "12",
    "--atlas-columns": "var(--atlas-columns-mobile)",
    "--atlas-gutter-mobile": "var(--atlas-spacing-4)",
    "--atlas-gutter-tablet": "var(--atlas-spacing-6)",
    "--atlas-gutter-desktop": "var(--atlas-spacing-8)",
    "--atlas-gutter": "var(--atlas-gutter-mobile)",
    "--atlas-margin-mobile": "var(--atlas-spacing-4)",
    "--atlas-margin-tablet": "var(--atlas-spacing-6)",
    "--atlas-margin-desktop": "var(--atlas-spacing-8)",
    "--atlas-margin": "var(--atlas-margin-mobile)",
    "--atlas-content-width-xs": "240px",
    "--atlas-content-width-sm": "280px",
    "--atlas-content-width-md": "400px",
    "--atlas-content-width-lg": "880px",
    "--atlas-dialog-sm": "400px",
    "--atlas-dialog-md": "560px",
    "--atlas-dialog-lg": "720px",
    "--atlas-dialog-xl": "960px",
    "--atlas-safe-top": "env(safe-area-inset-top)",
    "--atlas-safe-bottom": "env(safe-area-inset-bottom)",
    "--atlas-safe-inline-start": "env(safe-area-inset-left)",
    "--atlas-safe-inline-end": "env(safe-area-inset-right)",
    "--atlas-z-base": "0",
    "--atlas-z-dropdown": "1000",
    "--atlas-z-sticky": "1100",
    "--atlas-z-overlay": "1200",
    "--atlas-z-modal": "1300",
    "--atlas-z-popover": "1400",
    "--atlas-z-toast": "1500",
    "--atlas-z-tooltip": "1600"
  },
  "figmaBound": {
    "source": "figma-synced — codeSyntax.WEB of the variables bound inside the component sets; NOT the Figma variable table (roadmap D1, option C)",
    "syncedAt": "2026-10-22T14:00:24.681Z",
    "figmaVersion": null,
    "note": "Partial by construction: drift is measured only over code tokens some component binds in Figma. A Figma variable no component binds, and a CSS token with no Figma variable, are invisible here. Kept as a cross-check of figmaTable.",
    "coverage": { "boundVariables": 193, "codeTokens": 432, "covered": 193, "summary": "0 drift over 193/432 covered" },
    "drift": { "nameDrift": [], "missingInCode": [] },
    "conventionExceptions": [
      { "figma": "font-family/mono", "css": "--atlas-font-mono" },
      { "figma": "font-family/sans", "css": "--atlas-font-sans" }
    ],
    "variables": {
      "avatar-squircle-radius-lg": { "css": "--atlas-avatar-squircle-radius-lg", "collection": "Atlas/Semantic", "type": "FLOAT" },
      "avatar-squircle-radius-md": { "css": "--atlas-avatar-squircle-radius-md", "collection": "Atlas/Semantic", "type": "FLOAT" },
      "avatar-squircle-radius-sm": { "css": "--atlas-avatar-squircle-radius-sm", "collection": "Atlas/Semantic", "type": "FLOAT" },
      "avatar-squircle-radius-xl": { "css": "--atlas-avatar-squircle-radius-xl", "collection": "Atlas/Semantic", "type": "FLOAT" },
      "avatar-squircle-radius-xs": { "css": "--atlas-avatar-squircle-radius-xs", "collection": "Atlas/Semantic", "type": "FLOAT" },
      "background": { "css": "--atlas-background", "collection": "Atlas/Semantic", "type": "COLOR" },
      "background-accent": { "css": "--atlas-background-accent", "collection": "Atlas/Semantic", "type": "COLOR" },
      "background-hovered": { "css": "--atlas-background-hovered", "collection": "Atlas/Semantic", "type": "COLOR" },
      "background-muted": { "css": "--atlas-background-muted", "collection": "Atlas/Semantic", "type": "COLOR" },